,Title,Description,PubDate,Categorie
67,Fontenay-aux-Roses : un collège sous le choc après l'agression d'une professeure,"Les cours ont repris au collège des Ormeaux de Fontenay-aux-Roses, dans les Hauts-de-Seine, vendredi 28 mars. Quelques jours plus tôt, une professeure d'EPS a été agressée par trois adolescents.","Fri, 28 Mar 2025 15:23:07 +0100",societe
68,"A Fontenay-aux-Roses, un collège sous le choc après l'agression d'une professeure d'EPS","Les cours ont repris vendredi au collège des Ormeaux, dans les Hauts-de-Seine. Quelques jours plus tôt, une professeure d'EPS a été agressée par trois adolescents.","Fri, 28 Mar 2025 15:29:16 +0100",societe
69,TikTok : les Français sont-ils prêts à faire leurs achats par la plateforme dès lundi ?,"À partir de lundi 31 mars, TikTok va proposer aux internautes français de faire leurs achats directement sur la plateforme. Une nouveauté testée par les Anglais qui divise.","Fri, 28 Mar 2025 16:32:20 +0100",societe
70,CARTE. Scandale de maltraitance dans les Ehpad : découvrez les 44 établissements fermés ou sanctionnés à l'issue du plan de contrôle lancé par le gouvernement,"Trois jours après la diffusion du documentaire ""Les Fossoyeurs"", co-écrit par Victor Castanet, l'exécutif a diffusé, vendredi, une première liste issue des investigations menées depuis 2022 dans les 7 500 Ehpad de France.","Fri, 28 Mar 2025 16:58:56 +0100",societe
71,"À Fontenay-aux-Roses, un collège sous le choc après l'agression d'une professeure d'EPS","Les cours ont repris vendredi au collège des Ormeaux, dans les Hauts-de-Seine. Quelques jours plus tôt, une professeure d'EPS a été agressée par trois adolescents.","Fri, 28 Mar 2025 17:36:18 +0100",societe
72,"Ce que prévoit la réforme de la formation des enseignants, présentée vendredi par François Bayrou et Elisabeth Borne","Plusieurs fois annoncée puis laissée de côté, cette réforme sera ""engagée pour la rentrée 2025"", a annoncé le Premier ministre vendredi.","Fri, 28 Mar 2025 17:32:58 +0100",societe
73,CARTE. Scandale de maltraitance dans les Ehpad : découvrez les 44 établissements fermés ou sanctionnés à l'issue du plan de contrôle lancé par le gouvernement,"Trois jours après la diffusion du documentaire ""Les Fossoyeurs"", co-écrit par Victor Castanet, l'exécutif a diffusé, vendredi, une première liste issue des investigations menées depuis 2022 dans les 7 500 Ehpad de France.","Fri, 28 Mar 2025 18:09:23 +0100",societe
74,"""En tant que citoyenne, dois-je m'inquiéter ?"" : le vrai ou faux junior répond aux questions sur l'effort de guerre","Manuel de survie, service militaire, menace russe... franceinfo démêle vraies informations et fake news anxiogènes avec les élèves du collège Jean Perrin de Nanterre.","Fri, 28 Mar 2025 18:24:27 +0100",societe
75,"Contrôle des Ehpad : 55 ""sanctions graves"" ont été prononcées contre des établissements","Ces contrôles ont révélé ""des faits graves de maltraitance, de dysfonctionnements importants"" ou ""des problèmes de prise en charge des soins"", a annoncé la ministre déléguée Charlotte Parmentier-Lecocq.","Fri, 28 Mar 2025 18:21:27 +0100",societe
76,"ENQUETE FRANCEINFO. Maltraitance des personnes âgées : le bilan mitigé du grand plan de contrôle des Ehpad, trois ans après le scandale soulevé par ""Les Fossoyeurs""","Faute de moyens, les inspecteurs missionnés pour contrôler les 7 500 Ehpad de France après l'affaire Orpea n'ont pu se déplacer que dans un tiers des établissements. Ils n'ont contrôlé les autres que sur documents.","Fri, 28 Mar 2025 18:28:50 +0100",societe
77,"""Ce jour-là, j'ai cru mourir"" : le voisin qui a tenté de sauver Chahinez Daoud de l'immolation raconte son face-à-face avec Mounir Boutaa","Le soir du féminicide, Gérard Van Cauwenberge a tenté de s'interposer, mais l'accusé a allumé le feu au corps de sa femme avant de le braquer avec son pistolet, l'empêchant d'agir. Le septuagénaire s'est constitué partie civile au procès.","Fri, 28 Mar 2025 18:34:53 +0100",societe
78,"""En tant que citoyenne, dois-je m'inquiéter ?"" : le vrai ou faux junior répond aux questions sur l'effort de guerre","Manuel de survie, service militaire, menace russe... franceinfo démêle vraies informations et fake news anxiogènes avec les élèves du collège Jean Perrin de Nanterre.","Fri, 28 Mar 2025 18:24:27 +0100",societe
79,Procès du féminicide de Chahinez Daoud : Mounir Boutaa condamné à la réclusion criminelle à perpétuité pour avoir brûlé vive son épouse,"La cour d'assises de la Gironde a livré son verdict vendredi soir, au terme de cinq jours d'audience. La peine est assortie d'une période de sûreté de 22 ans, conformément aux réquisitions.","Fri, 28 Mar 2025 19:05:24 +0100",societe
80,INFO FRANCEINFO. Un homme mis en examen pour viols par soumission chimique sur cinq de ses ex-compagnes dans les Yvelines,"Pendant sa garde à vue, le suspect a minimisé les accusations portées par ses ex-compagnes, arguant que les relations sexuelles étaient forcément consenties puisqu'ils étaient en couple.","Fri, 28 Mar 2025 19:01:29 +0100",societe
81,"Ce que prévoit la réforme de la formation des enseignants, présentée vendredi par François Bayrou et Elisabeth Borne",Les concours de l'enseignement seront désormais organisés à bac+3 et les deux années de master seront consacrées à une formation rémunérée et pensée pour être plus professionnalisante.,"Fri, 28 Mar 2025 17:32:58 +0100",societe
