,Title,Description,PubDate,Categorie
0,Procès de Gérard Depardieu : le parquet requiert 18 mois de prison avec sursis et 20 000 euros d'amende contre l'acteur,"L'acteur est jugé pour des agressions sexuelles sur deux femmes lors du tournage du film ""Les Volets verts"", en 2021.","Thu, 27 Mar 2025 15:56:53 +0100",societe
1,"Affaire Bétharram : ""C'est l'immense honte que notre institution en soit arrivée là"", déplore Laurent Bacho, porte-parole de la congrégation","Jusqu'à maintenant, le porte-parole de la Congrégation s'était peu exprimé sur l'affaire de violences sexuelles à Notre-Dame de Bétharram.","Thu, 27 Mar 2025 15:44:03 +0100",societe
2,Agression sexuelle : comment est-elle définie dans la loi ?,"Jugé depuis lundi à Paris pour agression sexuelle, Gérard Depardieu a affirmé à la barre : ""Je ne sais pas ce qu’est une agression sexuelle"". Pourtant, le Code pénal français en donne un définition claire.","Thu, 27 Mar 2025 15:33:33 +0100",societe
3,"VIDEO. Depuis l'attaque d'Incarville, sans doute planifiée depuis une prison, les téléphones portables sont la hantise du personnel pénitentiaire","Au centre de détention d'Oermingen, en Alsace, la directrice et ses équipes sont sur leurs gardes. Transférés depuis les prisons saturées des alentours, de nouveaux détenus risquent de faire entrer des téléphones portables, strictement interdits. Extrait d'une immersion à voir dans ""Envoyé spécial"".","Thu, 27 Mar 2025 15:31:54 +0100",societe
4,"VIDEO. ""Je me suis pas cassé la tête"" : Yanis a acheté illégalement son examen du code pour pouvoir passer le permis","Depuis que l'examen théorique du permis de conduire a été privatisé, en 2016, les fraudes se sont multipliées. Aujourd'hui, près 4&nbsp;codes de la route sur 10 obtenus chaque année seraient illicites. Yanis, 21&nbsp;ans, a acheté le sien. Représente-t-il un danger au volant&nbsp;? ""Envoyé spécial"" a testé son niveau.","Thu, 27 Mar 2025 13:28:48 +0100",societe
5,"Saisie du véhicule, garde à vue, comparution au tribunal : la police de Toulon renforce ces mesures contre les consommateurs de drogue pris en flagrant délit d'achat","Deux voitures ont notamment été saisies entre mardi et mercredi dans la cité Pontcarral, à Toulon. Les consommateurs ont également été placés en garde à vue. Le vendeur et deux guetteurs ont aussi été interpellés.","Thu, 27 Mar 2025 13:16:44 +0100",societe
6,"Le magazine allemand ""Der Spiegel"" révèle que des coordonnées privées de hauts responsables américains sont disponibles sur internet","Le magazine allemand explique avoir pu accéder à des données confidentielles : numéros de téléphone portable, des adresses électroniques et, dans certains cas, des mots de passe de responsables américains","Thu, 27 Mar 2025 12:35:48 +0100",societe
7,"Une enquête judiciaire ouverte pour ""bizutage, atteintes sexuelles et violences aggravées"" lors de soirées médecine à l’université de Tours",L’université de Tours a dévoilé lundi un plan de 27 mesures destinées à lutter contre les violences sexistes et sexuelles après un rapport mené par l’Inspection générale de l’Education du sport et de la recherche.,"Thu, 27 Mar 2025 12:07:38 +0100",societe
8,"Vrai ou faux. Procès de Gérard Depardieu : l'acteur bénéficie-t-il d’un traitement de faveur, comme l'affirme une avocate des plaignantes ?","Contrairement à la plupart des affaires d'agression sexuelle, le procès en correctionnelle de Gérard Depardieu s’étale sur plusieurs jours, et se tient dans des conditions de comparution peu ordinaires, avec une limite de temps d’audience quotidienne et l’autorisation pour l’acteur.
.","Thu, 27 Mar 2025 10:52:38 +0100",societe
9,"TEMOIGNAGES. ""Je refuse de baisser la tête"" : après l'agression d'Orléans, les rabbins de France ne veulent pas se laisser intimider","La violence qui s'est déchaînée sur le rabbin d'Orléans samedi a rouvert chez les représentants de la communauté juive des craintes déjà vivaces. Les agressions antisémites sont en augmentation en France depuis le 7-Octobre, selon les données du ministère de l'Intérieur.","Thu, 27 Mar 2025 09:05:33 +0100",societe
10,"""Si vous croisez ces comptes, signalez-les"" : la police nationale alerte sur l'utilisation de l'émoji pizza sur les réseaux sociaux","Selon les forces de l'ordre, des pédocriminels utilisent un langage codé afin de repérer des comptes proposant des contenus pédopornographiques.","Thu, 27 Mar 2025 08:49:37 +0100",societe
11,"REPORTAGE. Éducation affective et sexuelle : les enseignants formés au nouveau programme, avant sa mise en place à la rentrée prochaine","Les nouveaux programmes d'éducation à la vie affective et sexuelle sont prêts pour la rentrée prochaine. En attendant, c'est aux enseignants d'être formés par l'Éducation nationale.","Thu, 27 Mar 2025 08:12:08 +0100",societe
12,Accusation de violences à l'Institution Saint-Dominique de Neuilly : une première plainte déposée par une ancienne élève,"Constance Bertrand, ancienne élève et créatrice du groupe de victimes de l'institution catholique de région parisienne, a déposé plainte contre un surveillant pour des faits de harcèlements subis pendant l'année scolaire 1995-1996.","Thu, 27 Mar 2025 07:25:36 +0100",societe
13,Fraude à l'assurance maladie : la traque aux faux arrêts de travail,"De plus en plus d'escrocs usurpent l'identité de professionnels de santé pour délivrer des arrêts maladie frauduleux. Face à cette situation, de nouveaux arrêts seront mis en place à partir de l'été prochain.","Thu, 27 Mar 2025 07:25:08 +0100",societe
14,Consentement : le texte modifiant la définition pénale du viol adopté en commission à l'Assemblée,"Il sera examiné le 1er avril dans l'hémicycle, après une difficile rédaction issue d'une année de travaux et auditions.","Thu, 27 Mar 2025 00:00:30 +0100",societe
15,Éducation aux médias : comment éviter les fausses informations ?,"Pour éviter les fausses informations, des élèves d'une classe de seconde sont formés aux bonnes techniques. Ils se mettent notamment dans la peau de journalistes radio.","Wed, 26 Mar 2025 22:21:18 +0100",societe
16,Visite de Jordan Bardella en Israël : un nouvel acte de la dédiabolisation du Rassemblement national ?,"La visite en Israël du président du Rassemblement national, Jordan Bardella, suscite un certain malaise. Sur place, l'élu européen s'est vu rappeler l'héritage de Jean-Marie Le Pen, condamné à plusieurs reprises pour antisémitisme.","Wed, 26 Mar 2025 22:18:58 +0100",societe
17,Livraison à domicile : les livreurs des plateformes exposés à de multiples risques selon l'Anses,"Les livreurs des grandes plateformes de livraison à domicile seraient exposés à de multiples risques, sans droits suffisants pour se protéger, pointe une nouvelle enquête de l'Anses publiée mercredi 26 mars.","Wed, 26 Mar 2025 21:29:39 +0100",societe
18,Une opération lancée en Lituanie pour retrouver quatre soldats américains portés disparus lors d'exercices,"Ces hommes menaient un entraînement tactique, a précisé l'armée américaine. Ils n'ont plus été vus depuis mardi après-midi.","Wed, 26 Mar 2025 21:23:49 +0100",societe
19,"""Ce jour-là, j'ai cru mourir"" : le voisin qui a tenté de sauver Chahinez Daoud de l'immolation raconte son face-à-face avec Mounir Boutaa","Le soir du féminicide, Gérard Van Cauwenberge a tenté de s'interposer, mais l'accusé a allumé le feu au corps de sa femme avant de le braquer avec son pistolet, l'empêchant d'agir. Le septuagénaire s'est constitué partie civile au procès.","Wed, 26 Mar 2025 21:19:00 +0100",societe
20,Procès de Gérard Depardieu : le parquet requiert 18 mois de prison avec sursis et 20 000 euros d'amende contre l'acteur,"L'acteur est jugé pour des agressions sexuelles sur deux femmes lors du tournage du film ""Les Volets verts"", en 2021.","Thu, 27 Mar 2025 16:26:23 +0100",societe
21,"EN DIRECT. Le Talk - Guerre en Ukraine : le ""sommet des alliés"" servira-t-il à quelque chose ? Faut-il durcir la justice pénale des mineurs ? Venez poser vos questions en direct !","Au programme du Talk de franceinfo du jeudi 27 mars, la visite en France du président ukrainien, son entretien fleuve diffusé sur franceinfo et la tenue d'un sommet des alliés de l'Ukraine, puis la proposition de loi visant à restaurer l'autorité de la justice à l'égard des mineurs délinquants et de leurs parents.","Thu, 27 Mar 2025 16:46:53 +0100",societe
22,"EN DIRECT. Le Talk - Guerre en Ukraine : le ""sommet des alliés"" servira-t-il à quelque chose ? Fallait-il durcir la justice pénale des mineurs ? Venez poser vos questions en direct !","Au programme du Talk de franceinfo du jeudi 27 mars, la visite en France du président ukrainien, son entretien fleuve diffusé sur franceinfo et la tenue d'un sommet des alliés de l'Ukraine, puis la proposition de loi visant à restaurer l'autorité de la justice à l'égard des mineurs délinquants et de leurs parents.","Thu, 27 Mar 2025 16:54:50 +0100",societe
23,Procès de Gérard Depardieu : le parquet requiert 18 mois de prison avec sursis et 20 000 euros d'amende contre l'acteur,"L'acteur est jugé pour des agressions sexuelles sur deux femmes lors du tournage du film ""Les Volets verts"", en 2021.","Thu, 27 Mar 2025 16:57:48 +0100",societe
24,"EN DIRECT. Le Talk - Guerre en Ukraine : le ""sommet des alliés"" servira-t-il à quelque chose ? Faut-il vraiment durcir la justice pénale des mineurs ? Venez poser vos questions en direct !","Au programme du Talk de franceinfo du jeudi 27 mars, la visite en France du président ukrainien, son entretien fleuve diffusé sur franceinfo et la tenue d'un sommet des alliés de l'Ukraine, puis la proposition de loi visant à restaurer l'autorité de la justice à l'égard des mineurs délinquants et de leurs parents.","Thu, 27 Mar 2025 16:57:05 +0100",societe
25,Procès de Gérard Depardieu : le parquet requiert 18 mois de prison avec sursis et 20 000 euros d'amende contre l'acteur,"L'acteur est jugé pour des agressions sexuelles sur deux femmes lors du tournage du film ""Les Volets verts"", en 2021.","Thu, 27 Mar 2025 17:42:39 +0100",societe
26,"H&M veut générer des ""répliques numériques"" de mannequins grâce à l'intelligence artificielle pour des campagnes publicitaires","Selon l'entreprise suédoise de prêt-à-porter, les mannequins seront propriétaires des droits de leurs ""jumeaux numériques"", a révélé le site internet britannique The Business of Fashion.","Thu, 27 Mar 2025 18:22:01 +0100",societe
27,Procès de Gérard Depardieu : le parquet requiert 18 mois de prison avec sursis et 20 000 euros d'amende contre l'acteur,"L'acteur est jugé pour des agressions sexuelles sur deux femmes lors du tournage du film ""Les Volets verts"", en 2021.","Thu, 27 Mar 2025 18:39:07 +0100",societe
28,Procès de Gérard Depardieu : le parquet requiert 18 mois de prison avec sursis et 20 000 euros d'amende contre l'acteur,"L'acteur est jugé pour des agressions sexuelles sur deux femmes lors du tournage du film ""Les Volets verts"", en 2021.","Thu, 27 Mar 2025 19:05:08 +0100",societe
29,"EN REPLAY. Le Talk - Guerre en Ukraine : le ""sommet des alliés"" servira-t-il à quelque chose ? Faut-il vraiment durcir la justice pénale des mineurs ?","Au programme du Talk de franceinfo du jeudi 27 mars, la visite en France du président ukrainien, son entretien fleuve diffusé sur franceinfo et la tenue d'un sommet des alliés de l'Ukraine, puis la proposition de loi visant à restaurer l'autorité de la justice à l'égard des mineurs délinquants et de leurs parents.","Thu, 27 Mar 2025 19:08:05 +0100",societe
30,Procès de Gérard Depardieu : le parquet requiert 18 mois de prison avec sursis et 20 000 euros d'amende contre l'acteur,"Il est accusé d'agressions sexuelles sur deux femmes lors du tournage du film ""Les Volets verts"", en 2021. Le jugement sera rendu le 13 mai.","Thu, 27 Mar 2025 19:05:08 +0100",societe
31,"""Ma fille n'a pas voulu être prisonnière, c'est pour ça qu'elle est morte"" : au procès du féminicide de Chahinez Daoud, la douleur de la famille de la victime","Au quatrième jour du procès de Mounir Boutaa, accusé d'avoir assassiné sa femme en 2021, la famille de la victime a témoigné devant la cour, jeudi.","Thu, 27 Mar 2025 19:37:04 +0100",societe
32,"Présence militaire européenne en Ukraine : ""Cela me paraît prématuré"", dit l'ancien président de la commission des Affaires étrangères à l'Assemblée","Emmanuel Macron a évoqué jeudi  un possible déploiement de forces de ""plusieurs pays européens"" alliés après un éventuel accord de paix, à l'issue d'une réunion à Paris d'une coalition des États soutenant Kiev.","Thu, 27 Mar 2025 19:35:59 +0100",societe
33,"Après les Ehpad, le gouvernement va contrôler 500 établissements qui accueillent des jeunes handicapés","La ministre de l’Autonomie et du Handicap veut prioriser les structures avec hébergement, mais aussi celles qui accueillent des enfants.","Thu, 27 Mar 2025 20:38:20 +0100",societe
34,Une enquête ouverte en Belgique sur des dizaines d'agressions sexuelles sous soumission chimique,"Trois suspects ont notamment été identifiés. Ces patrons de cafés ""se connaissaient et échangeaient leurs expériences"", a déclaré à la télévision un porte-parole du parquet de Flandre occidentale. Les premiers éléments évoquent un recours à la kétamine.","Thu, 27 Mar 2025 18:25:37 +0100",societe
35,"Un avion de reconnaissance russe s'est approché des côtes allemandes, avant d'être escorté","L'appareil volait ""sans plan de vol ni transpondeur en activité"", selon l'armée de l'air allemande.","Thu, 27 Mar 2025 21:57:22 +0100",societe
36,Le ministère de l'Economie et des Finances a été perquisitionné dans une enquête pour blanchiment immobilier visant un milliardaire russe,"L'information a été communiquée par le parquet de Paris, qui évoque ""un enjeu estimé à 38 millions d'euros"".","Thu, 27 Mar 2025 22:08:36 +0100",societe
37,VIDEO. Code : le permis de tricher ?,"La privatisation du code la route, en 2016, a entraîné une fraude massive&nbsp;: près de 40% des codes délivrés chaque année seraient des ""faux"". Quant à l'examen pratique, les délais d'attente se sont dangereusement allongés... Retour sur une catastrophe.","Thu, 27 Mar 2025 22:03:08 +0100",societe
38,Les zones à faibles émissions (ZFE) bientôt supprimées ? Un projet de loi examiné le 8 avril à l'Assemblée,"Dans le collimateur de nombreux conducteurs et élus, les ZFE, zones à faibles émissions, censées diminuer la pollution en ville, pourraient bientôt disparaître. Un texte demandant leur suppression doit être examiné le 8 avril à l'Assemblée nationale.","Thu, 27 Mar 2025 22:16:32 +0100",societe
39,Blanchiment d'argent : un yacht vendu aux enchères pour 10 millions d'euros,Un yacht saisi à un milliardaire biélorusse impliqué dans une affaire de blanchiment d'argent a été vendu plus de 10 millions d'euros jeudi 27 mars.,"Thu, 27 Mar 2025 22:15:24 +0100",societe
40,Le ministère de l'Economie et des Finances a été perquisitionné dans une enquête pour blanchiment immobilier visant un milliardaire russe,"L'information a été communiquée par le parquet de Paris, qui évoque ""un enjeu estimé à 38 millions d'euros"".","Thu, 27 Mar 2025 22:58:57 +0100",societe
41,VIDEO. Ma prison va craquer,"La prison d’Oermingen était une prison modèle. Désormais touchée par la surpopulation carcérale, elle doit accueillir des détenus plus difficiles, plus jeunes et plus violents. Cet afflux de prisonniers va-t-il ruiner le travail et les efforts engagés pour favoriser la réinsertion&nbsp;?","Thu, 27 Mar 2025 23:35:05 +0100",societe
42,Les zones à faibles émissions (ZFE) bientôt supprimées ? Un projet de loi examiné le 8 avril à l'Assemblée,"Dans le collimateur de nombreux conducteurs et élus, les ZFE, zones à faibles émissions, censées diminuer la pollution en ville, pourraient bientôt disparaître. Un texte demandant leur suppression doit être examiné le 8 avril à l'Assemblée nationale.","Fri, 28 Mar 2025 00:22:37 +0100",societe
43,"VRAI OU FAUX. Peut-on vraiment expulser les étrangers détenus dans les prisons françaises, comme le souhaite Gérald Darmanin ?","Dans l'Union européenne, le transfert de prisonniers entre Etats membres est déjà régi par une décision-cadre de 2008. Pour les autres pays, la France doit obtenir des accords bilatéraux, ce qui peut prendre plusieurs mois.","Fri, 28 Mar 2025 05:53:40 +0100",societe
44,Radio France met à disposition une sélection de 800 podcasts pour réviser le bac,"Dès ce vendredi, des centaines de productions issues des chaînes du groupe sont mises à disposition des lycéens pour réviser des thèmes du baccalauréat.","Fri, 28 Mar 2025 06:45:23 +0100",societe
45,"H&M veut générer des ""répliques numériques"" de mannequins grâce à l'intelligence artificielle pour des campagnes publicitaires","Selon l'entreprise suédoise de prêt-à-porter, les mannequins seront propriétaires des droits de leurs ""jumeaux numériques"", a révélé le site internet britannique The Business of Fashion.","Fri, 28 Mar 2025 07:09:08 +0100",societe
46,Agression sexuelle : comment est-elle définie dans la loi ?,"Jugé depuis lundi à Paris pour agression sexuelle, Gérard Depardieu a affirmé à la barre : ""Je ne sais pas ce qu’est une agression sexuelle"". Pourtant, le Code pénal français en donne un définition claire.","Fri, 28 Mar 2025 07:08:46 +0100",societe
47,"REPORTAGE. ""À chaque fois, on a des enfants qui se calment"" : dans la Sarthe, élèves et enseignants profitent des bienfaits de faire classe dehors","De plus en plus d'écoles pratiquent les cours en extérieur, en forêt ou dans la cour. À Allonnes, près du Mans, tout le monde profite et ressent les bienfaits de cette pratique, sur l'apprentissage comme sur le comportement.","Fri, 28 Mar 2025 07:26:13 +0100",societe
48,"Abus sexuels dans l'Église : de la maladresse à la rétention d’informations, les manquements de 18 évêques actuellement en poste après des signalements","A quelques jours de l'assemblée plénière des évêques de France, France Inter a enquêté sur les affaires d’abus sexuels de chaque diocèse et a retracé le parcours de chaque évêque pour comprendre la manière dont chacun prend en compte les alertes qui remontent, accueille les témoignages ou accompagne les victimes.","Fri, 28 Mar 2025 07:24:50 +0100",societe
49,"REPORTAGE. ""À chaque fois, on a des enfants qui se calment"" : dans la Sarthe, élèves et enseignants profitent des bienfaits de faire classe dehors","De plus en plus d'écoles pratiquent les cours en extérieur, en forêt ou dans la cour. À Allonnes, près du Mans, tout le monde profite et ressent les bienfaits de cette pratique, sur l'apprentissage comme sur le comportement.","Fri, 28 Mar 2025 07:34:24 +0100",societe
50,"Dématérialisation, contrôles et harmonisation des règles... Trois questions sur le futur permis de conduire européen","Valable 15 ans et notamment accessible sur smartphone, ce permis continental aura la même valeur que le permis de conduire physique. Il pourrait entrer en vigueur dès 2030.","Fri, 28 Mar 2025 07:44:42 +0100",societe
51,"Violences sexuelles dans l'Église : de la maladresse à la rétention d’informations, les manquements de 18 évêques actuellement en poste après des signalements","A quelques jours de l'assemblée plénière des évêques de France, France Inter a enquêté sur les affaires de violences sexuelles de chaque diocèse et a retracé le parcours de chaque évêque pour comprendre la manière dont chacun prend en compte les alertes qui remontent, accueille les témoignages ou accompagne les victimes.","Fri, 28 Mar 2025 07:24:50 +0100",societe
52,"""Acculturer, sensibiliser, former…"" : un guide de bonnes pratiques pour améliorer l'inclusion des personnes trans et non binaires au travail",Ce troisième guide employeur est le premier de l'association L'Autre Cercle qui inclut la non-binarité.,"Fri, 28 Mar 2025 07:46:52 +0100",societe
53,"L'avocate d'une étudiante turque accuse la police américaine de l'immigration de l'avoir ""enlevée""","Rumeysa Ozturk a été arrêtée aux Etats-Unis par la police de l'immigration. ""Nous devrions tous être horrifiés de la manière dont [le ministère de la Sécurité intérieure] a enlevé Rumeysa [Ozturk] en plein jour"", a dénoncé son avocate.","Fri, 28 Mar 2025 08:12:48 +0100",societe
54,"Affaire Chahinez Daoud : “Il y a de bout en bout de la chaîne des dysfonctionnements et il faut s’atteler à les régler”, affirme la directrice générale de la fédération nationale Solidarités Femmes","Mine Günbay, directrice générale de la fédération nationale Solidarités Femmes, était l'invitée de la Matinale de France Info pour parler de la mort de Chahinez Daoud. Ce féminicide avait provoqué une vague d’émotion dans le pays.","Fri, 28 Mar 2025 08:59:56 +0100",societe
55,"L'avocate d'une étudiante turque accuse la police américaine de l'immigration de l'avoir ""enlevée""","Rumeysa Ozturk a été arrêtée aux Etats-Unis par la police de l'immigration. ""Nous devrions tous être horrifiés de la manière dont [le ministère de la Sécurité intérieure] a enlevé Rumeysa [Ozturk] en plein jour"", a dénoncé son avocate.","Fri, 28 Mar 2025 09:05:00 +0100",societe
56,Mort du petit Émile : les regards restent tournés vers la famille de l'enfant,"Les gardes à vue des grands-parents d'Émile, de son oncle et de sa tante ont été levées, jeudi 27 mars. La famille du petit garçon, discrète et dominée par le patriarche, doit toutefois vivre avec le poids du soupçon.","Fri, 28 Mar 2025 09:32:07 +0100",societe
57,Deux entraîneurs d’un club de boxe de Nantes visés par des signalements d’agressions sexuelles,"Certains adhérents et anciens adhérents du club estiment que les deux entraîneurs, reconnus dans le milieu de la boxe, ont pu bénéficier d’une forme d'omerta.","Fri, 28 Mar 2025 10:01:00 +0100",societe
58,"PODCAST. Le concert ""Solidarité Congo"" reporté, prépare ton sac de survie et changement d'heure : ça dit quoi ce 28 mars ?","Ce vendredi 28 mars, un concert caritatif qui devait rassembler des stars d'origine congolaise comme GIMS à Paris est reporté à cause du conflit avec le Rwanda, l'UE invite tous ses habitants à préparer un kit de survie et on passe à l'heure d'été ce week-end.","Fri, 28 Mar 2025 10:10:07 +0100",societe
59,"""Ce n'était pas moi, c'était mon corps"" : au procès du féminicide de Chahinez Daoud, Mounir Boutaa n'a cessé de se dédouaner","L'accusé de 48 ans a été interrogé jeudi sur l'assassinat de son épouse, brûlée vive le 4 mai 2021. Mounir Boutaa n'a montré aucun remords et s'est enfermé dans sa propre logique.","Fri, 28 Mar 2025 10:17:11 +0100",societe
60,Procès du féminicide de Chahinez Daoud : la réclusion criminelle à perpétuité requise contre l'accusé,"L'avocate générale a requis la perpétuité, assortie d'une période de sûreté de 22 ans, contre Mounir Boutaa, pour ""l'assassinat"" en mai 2021 de son épouse Chahinez Daoud, brûlée vive à Mérignac, près de Bordeaux.","Fri, 28 Mar 2025 11:05:19 +0100",societe
61,Procès du féminicide de Chahinez Daoud : la réclusion criminelle à perpétuité requise contre l'accusé,"L'avocate générale a requis la perpétuité, assortie d'une période de sûreté de 22 ans, contre Mounir Boutaa, pour l'assassinat en mai 2021 de son épouse Chahinez Daoud, brûlée vive à Mérignac, près de Bordeaux.","Fri, 28 Mar 2025 11:12:27 +0100",societe
62,Les PME demandent des garanties pour renforcer l'armement français,"Les entreprises sont prêtes à répondre aux attentes de l'État, qui souhaite renforcer l'armement français, mais à certaines conditions. Les PME attendent notamment des engagements fermes de la part du gouvernement.","Fri, 28 Mar 2025 11:31:24 +0100",societe
63,Espagne : la condamnation pour viol de l'ex-joueur du Barça et du PSG Dani Alves annulée en appel,"Condamné à quatre ans et demi de prison pour viol en 2024, mais libéré sous caution, Dani Alves a vu sa condamnation annulée par la Cour d'appel de Barcelone, vendredi.","Fri, 28 Mar 2025 12:02:48 +0100",societe
64,Espagne : la condamnation pour viol de l'ex-joueur du Barça et du PSG Dani Alves annulée en appel,"Condamné à quatre ans et demi de prison pour viol en 2024, mais libéré sous caution, Dani Alves a vu sa condamnation annulée par la Cour d'appel de Barcelone, vendredi.","Fri, 28 Mar 2025 12:09:45 +0100",societe
65,"VIDEO. Loi sur la justice des mineurs :  ""C'est très grave, on reste sans voix : le texte voté est dix fois pire que ce qu'on craignait"", alerte Adeline Hazan","Adeline Hazan, présidente de l'Unicef France et ancienne magistrate pour enfant estime dans le Talk de franceinfo que la proposition de loi de l’ancien Premier ministre Gabriel Attal visant à durcir la justice des mineurs, adoptée mercredi 26 mars par le Sénat, balaie tous les principes de la justice des mineurs.","Fri, 28 Mar 2025 14:57:42 +0100",societe
66,"EN REPLAY. Le Talk - Guerre en Ukraine : le ""sommet des alliés"" servira-t-il à quelque chose ? Faut-il vraiment durcir la justice pénale des mineurs ?","Au programme du Talk de franceinfo du jeudi 27 mars, la visite en France du président ukrainien, son entretien fleuve diffusé sur franceinfo et la tenue d'un sommet des alliés de l'Ukraine, puis la proposition de loi visant à restaurer l'autorité de la justice à l'égard des mineurs délinquants et de leurs parents.","Fri, 28 Mar 2025 15:01:00 +0100",societe
